{
  "schema_version": 1,
  "id": "cyber",
  "name": "Cybersecurity Research",
  "version": "0.1.0",
  "status": "implemented",
  "description": "Hardware resource policy for VM/container-heavy security research workloads: the same conservative, evidence-based CPU/memory/storage policy as 'balanced', biased for stable virtualization behavior rather than AI-style peak compute. This is resource policy only — the actual isolated security tooling/VM images (S5 scope, ADR-0004) are separate, unimplemented future work. No networking or security configuration is touched in S2. See docs/hardware/architecture.md.",
  "dependencies": ["core"],
  "conflicts": [],
  "packages": ["power-profiles-daemon", "systemd-zram-generator"],
  "services": [],
  "configuration_units": ["zram-generator-defaults"],
  "hardware_conditions": [],
  "verification_checks": [
    "hardware_report_integrity",
    "hardware_cpu_topology",
    "hardware_memory_detection",
    "hardware_storage_detection",
    "hardware_power_consistency",
    "hardware_existing_zram",
    "hardware_profile_plan_generation",
    "hardware_virtualization_guard",
    "hardware_required_resources"
  ],
  "rollback": {
    "supported": false,
    "notes": "No Apply mechanism exists yet in S2; serein hardware plan is read-only. See docs/hardware/architecture.md for what a future Apply step would need."
  }
}
